{
  "project": {
    "name": "PigeonCoop",
    "updated_at": "2026-07-08T00:00:00Z",
    "source_docs": [
      "docs/README.md",
      "docs/PRD.md",
      "docs/ARCHITECTURE.md",
      "docs/DESIGN_SPEC.md",
      "docs/VISUAL_IDENTITY.md",
      "AGENTS.md",
      "docs/DECISIONS.md",
      "docs/EVENT_SCHEMA.md",
      "docs/REPO_STRUCTURE.md",
      "docs/TESTING.md",
      "docs/TAURI_IPC_CONTRACT.md"
    ]
  },
  "statuses": [
    "todo",
    "ready",
    "in_progress",
    "blocked",
    "in_review",
    "done",
    "deferred"
  ],
  "task_groups": [
    {
      "group_id": "FOUND",
      "title": "Foundations and repository scaffolding",
      "description": "Workspace scaffolding, schema files, example workflow, and CI baseline are in place."
    },
    {
      "group_id": "MODEL",
      "title": "Workflow model and schemas",
      "description": "Workflow, run, memory, constraints, and typed node-config models are implemented with unit coverage."
    },
    {
      "group_id": "EVENT",
      "title": "Event system and typed events",
      "description": "Typed event families are implemented in the event-model crate; dedicated event-model test cleanup remains."
    },
    {
      "group_id": "ENGINE",
      "title": "Core execution engine",
      "description": "State machines, validator, scheduler, coordinator, human review handling, and guardrails are implemented with broad tests."
    },
    {
      "group_id": "PERSIST",
      "title": "SQLite persistence layer",
      "description": "SQLite schema, migrations, and workflow/run/event repositories exist; settings repository and persistence-specific tests are still missing."
    },
    {
      "group_id": "ADAPT",
      "title": "Runtime adapters",
      "description": "Adapter trait plus CLI, tool, agent, and mock adapters exist; adapter tests and engine dispatch integration remain."
    },
    {
      "group_id": "TAURI",
      "title": "Tauri desktop shell and bridge",
      "description": "Workflow/run/review commands and the event bridge exist; replay event-log queries, settings/workspace commands, and real runtime adapter dispatch are not yet fully exposed through the desktop execution path."
    },
    {
      "group_id": "UI-BLD",
      "title": "Builder view",
      "description": "The builder shell, canvas, node rendering, and save/load flows exist; palette, inspector, validation feedback, and richer tests are still pending."
    },
    {
      "group_id": "UI-RUN",
      "title": "Live run monitor view",
      "description": "The live view has a HUD, animated graph, event feed/detail inspector, and review overlay; command-output specific UX and complete tests remain."
    },
    {
      "group_id": "UI-RPL",
      "title": "Replay and debugging view",
      "description": "Replay layout, scrubber, event list, and inspector exist in the frontend; graph playback, diff panes, and backend event-log wiring remain incomplete."
    },
    {
      "group_id": "UX",
      "title": "UX, library view, and distribution",
      "description": "Library view, onboarding, keyboard UX, theming, and distribution tasks."
    },
    {
      "group_id": "SPRITE",
      "title": "Game visual identity — sprites, backdrop, and resource indicators",
      "description": "Character sprite node system, animated backdrop, health/resource bars, and all game-aesthetic visual features. See docs/VISUAL_IDENTITY.md for the full specification."
    },
    {
      "group_id": "DOCS",
      "title": "Documentation upkeep",
      "description": "Keeping repo, IPC, testing, and schema docs aligned with implementation as it changes."
    },
    {
      "group_id": "TEST",
      "title": "Testing",
      "description": "Rust unit tests, frontend component tests, and E2E coverage; several end-to-end flows are still partial."
    },
    {
      "group_id": "DEC",
      "title": "Unresolved decisions",
      "description": "Open design decisions that must be resolved before or during implementation of their affected areas."
    }
  ],
  "tasks": [
    {
      "id": "FOUND-001",
      "group_id": "FOUND",
      "title": "Rust workspace and crate skeleton",
      "status": "done",
      "priority": "high",
      "type": "implementation",
      "summary": "Cargo workspace with all crates created and building.",
      "description": "The root Cargo.toml workspace is configured with crates: workflow-model, event-model, core-engine, runtime-adapters, persistence, simulation, and apps/desktop/src-tauri. Shared workspace dependencies are declared.",
      "acceptance_criteria": [
        "cargo build succeeds from workspace root",
        "All documented crates exist and have Cargo.toml",
        "Workspace resolver = 2"
      ],
      "depends_on": [],
      "blocked_by": [],
      "files": [
        "Cargo.toml",
        "crates/workflow-model/Cargo.toml",
        "crates/event-model/Cargo.toml",
        "crates/core-engine/Cargo.toml",
        "crates/runtime-adapters/Cargo.toml",
        "crates/persistence/Cargo.toml",
        "crates/simulation/Cargo.toml"
      ],
      "docs": [
        "docs/REPO_STRUCTURE.md",
        "docs/ARCHITECTURE.md"
      ],
      "notes": [
        "Done. Verified via Cargo.toml and directory layout."
      ],
      "commands": [
        "cargo build"
      ],
      "estimate": "S"
    },
    {
      "id": "FOUND-002",
      "group_id": "FOUND",
      "title": "Frontend project setup",
      "status": "done",
      "priority": "high",
      "type": "implementation",
      "summary": "Vite + React + TypeScript + React Flow + Vitest frontend project configured.",
      "description": "apps/desktop has package.json with React 18, TypeScript 5, Vite 5, Vitest, React Testing Library, reactflow, and Tauri API packages. Tauri mock infrastructure for tests is in place.",
      "acceptance_criteria": [
        "npm install succeeds",
        "npm run dev starts the dev server",
        "npm test runs Vitest",
        "Tauri API mock exists at src/__mocks__/@tauri-apps/api/core.ts"
      ],
      "depends_on": [],
      "blocked_by": [],
      "files": [
        "apps/desktop/package.json",
        "apps/desktop/vite.config.ts",
        "apps/desktop/tsconfig.json",
        "apps/desktop/src/__tests__/setup.ts",
        "apps/desktop/src/__mocks__/@tauri-apps/api/core.ts"
      ],
      "docs": [
        "docs/TESTING.md"
      ],
      "notes": [
        "Done. reactflow ^11 included. Tauri API mock in place."
      ],
      "commands": [
        "cd apps/desktop && npm install",
        "npm test"
      ],
      "estimate": "S"
    },
    {
      "id": "FOUND-003",
      "group_id": "FOUND",
      "title": "JSON schema files for workflow and run-event",
      "status": "done",
      "priority": "medium",
      "type": "implementation",
      "summary": "Draft JSON Schema documents for WorkflowDefinition and RunEvent exist.",
      "description": "schemas/workflow.schema.json and schemas/run-event.schema.json have been created with draft-07 JSON Schema definitions covering the core fields from the architecture docs.",
      "acceptance_criteria": [
        "schemas/workflow.schema.json validates against a well-formed workflow JSON",
        "schemas/run-event.schema.json covers the RunEvent envelope fields"
      ],
      "depends_on": [],
      "blocked_by": [
        "DEC-001"
      ],
      "files": [
        "schemas/workflow.schema.json",
        "schemas/run-event.schema.json"
      ],
      "docs": [
        "docs/EVENT_SCHEMA.md",
        "docs/ARCHITECTURE.md"
      ],
      "notes": [
        "Schema exists but may need updating as typed event payloads are finalized."
      ],
      "commands": [],
      "estimate": "S"
    },
    {
      "id": "FOUND-004",
      "group_id": "FOUND",
      "title": "Canonical demo workflow JSON",
      "status": "done",
      "priority": "medium",
      "type": "implementation",
      "summary": "Plan -> Execute Tool -> Critique -> Approve workflow.json exists with all 6 nodes and 5 edges.",
      "description": "examples/plan-execute-critique-approve/workflow.json is populated with Start, Agent(Plan), Tool(Execute), Agent(Critique), HumanReview(Approve), End nodes and appropriate edges and memory access contracts.",
      "acceptance_criteria": [
        "workflow.json is valid against schemas/workflow.schema.json",
        "All six node types present in the file match the v1 node taxonomy",
        "All edges use correct condition_kind values"
      ],
      "depends_on": [
        "FOUND-003"
      ],
      "blocked_by": [],
      "files": [
        "examples/plan-execute-critique-approve/workflow.json",
        "examples/plan-execute-critique-approve/README.md"
      ],
      "docs": [
        "docs/ARCHITECTURE.md"
      ],
      "notes": [
        "Fully populated. Used as the integration test target for all test layers."
      ],
      "commands": [],
      "estimate": "XS"
    },
    {
      "id": "FOUND-005",
      "group_id": "FOUND",
      "title": "CI pipeline setup",
      "status": "done",
      "priority": "medium",
      "type": "implementation",
      "summary": "GitHub Actions pipeline running cargo test, npm test, and (on PR) E2E tests.",
      "description": "Create a .github/workflows/ci.yml (or equivalent) that runs: (1) cargo test for all Rust crates, (2) npm test for the frontend, (3) E2E tests against a Tauri debug build on PR/pre-merge. Use Xvfb on Linux for E2E. Cache cargo and node_modules.",
      "acceptance_criteria": [
        "CI runs on push and PR",
        "cargo test stage passes",
        "npm test stage passes",
        "E2E stage runs tauri-driver + WebdriverIO against a compiled binary",
        "Pipeline clearly separates fast (unit) and slow (E2E) stages"
      ],
      "depends_on": [],
      "blocked_by": [],
      "files": [
        ".github/workflows/ci.yml"
      ],
      "docs": [
        "docs/TESTING.md"
      ],
      "notes": [